{
  "exchange_version": "0.1.0",
  "kind": "opsfeast-observations",
  "exported_at": "2026-10-10T09:00:02+08:00",
  "records": [
    {
      "contract_version": "0.1.0",
      "observation_id": "00000000-0000-0000-0000-000000000001:afaf9dfdf0870c7b49b3700efc0e4a286c82dfc7037782423fee7bdf284de844",
      "source_id": "00000000-0000-0000-0000-000000000001",
      "host_id": "example-host-01",
      "host_key": "fallback:00000000-0000-0000-0000-000000000001:59a73c5b324500c9d0d24bf699bc7e4167ffcc5f866c43e65cebde36c9574f30",
      "identity_method": "source-host-id",
      "identity_quality": "fallback",
      "identity_evidence": [],
      "identity_warning": "Source-scoped fallback cannot establish cross-installation identity or replacement.",
      "recipe_id": "inventory-system",
      "recipe_version": "0.3.0",
      "raw_schema_version": "0.2.0",
      "started_at": "2026-10-10T01:00:00.000000+00:00",
      "observed_at": "2026-10-10T01:00:02.000000+00:00",
      "evidence_kind": "local",
      "status": "partial",
      "observations": {
        "hostname": {
          "value": "example-node",
          "status": "success",
          "observed_at": "2026-10-10T01:00:01.000000+00:00"
        },
        "platform": {
          "value": "linux",
          "status": "success",
          "observed_at": "2026-10-10T01:00:01.000000+00:00"
        },
        "system_name": {
          "value": "Example Linux",
          "status": "success",
          "observed_at": "2026-10-10T01:00:02.000000+00:00"
        },
        "system_version": {
          "value": null,
          "status": "unavailable",
          "observed_at": "2026-10-10T01:00:02.000000+00:00"
        },
        "kernel_name": {
          "value": "Linux",
          "status": "success",
          "observed_at": "2026-10-10T01:00:01.000000+00:00"
        },
        "kernel_release": {
          "value": "6.0.0-example",
          "status": "success",
          "observed_at": "2026-10-10T01:00:01.000000+00:00"
        },
        "architecture": {
          "value": "x86_64",
          "status": "success",
          "observed_at": "2026-10-10T01:00:01.000000+00:00"
        }
      },
      "inventory_contract_version": "0.1.0",
      "inventory": {
        "system": {
          "hostname": "example-node",
          "platform": "linux",
          "system_name": "Example Linux",
          "system_version": null,
          "kernel_name": "Linux",
          "kernel_release": "6.0.0-example",
          "architecture": "x86_64",
          "uptime_seconds": null,
          "timezone": null,
          "virtualization": null
        },
        "hardware": {
          "cpu_model": "Synthetic CPU",
          "logical_cpus": 4,
          "memory_total_bytes": 8589934592,
          "vendor": null,
          "model": null,
          "serial": null,
          "uuid": null
        },
        "storage": {
          "filesystems": null,
          "block_devices": null
        },
        "network": {
          "interfaces": [
            {
              "name": "example0",
              "address": "192.0.2.10",
              "prefix_length": 24,
              "mtu": 1500
            }
          ],
          "routes": null,
          "dns_servers": null,
          "listening_endpoints": null
        },
        "software": {
          "packages": null
        },
        "services": {
          "services": []
        }
      },
      "collection_scope": {
        "mode": "user",
        "effective_uid": 1001
      }
    }
  ]
}
